url	title
https://www.youtube.com/results?search_query=virtual+connection+tcpip	Quick intro: How TCP/IP Works by TALtech Media 23,864 views 2 years ago 1 minute, 37 seconds
https://www.youtube.com/results?search_query=virtual+connection+tcpip	Network Myths: TCP/IP by David Bombal 130,881 views 3 years ago 14 minutes, 11 seconds
https://www.youtube.com/results?search_query=virtual+connection+tcpip	TCP connection walkthrough | Networking tutorial (13 of 13) by Ben Eater 514,724 views 9 years ago 9 minutes, 31 seconds
https://www.youtube.com/results?search_query=virtual+connection+tcpip	COM31. TCP/IP - TSEND TRCV TCP Communication via Siemens S7-1200 S7-1500 PLC and TIA Portal by Electrical Automation Hands-On 13,611 views 1 year ago 48 minutes
https://www.youtube.com/results?search_query=virtual+connection+tcpip	TCP vs UDP Comparison by PowerCert Animated Videos 1,694,348 views 7 years ago 4 minutes, 37 seconds
https://www.youtube.com/results?search_query=virtual+connection+tcpip	Network Ports Explained by PowerCert Animated Videos 1,667,006 views 2 years ago 10 minutes, 33 seconds
https://www.youtube.com/results?search_query=virtual+connection+tcpip	TCP/IP Connection Sniffer via Tycho Virtual Machine Introspection Demo by Cyberus Technology GmbH 101 views 4 years ago 26 seconds
https://www.youtube.com/results?search_query=virtual+connection+tcpip	PLCSIM Advanced - How to create and download a PLC Program to a Virtual PLC via the Nework (TCP/IP) by FryTech 12,662 views 2 years ago 12 minutes, 8 seconds
https://www.youtube.com/results?search_query=virtual+connection+tcpip	OSI and TCP IP Models - Best Explanation by _Drunk Engineer_ 404,204 views 7 years ago 19 minutes
https://www.youtube.com/results?search_query=virtual+connection+tcpip	TCP Fundamentals Part 1 // TCP/IP Explained with Wireshark by Chris Greer 431,442 views 6 years ago 1 hour, 17 minutes
https://www.youtube.com/results?search_query=virtual+connection+tcpip	TCP/IP and Subnet Masking by Eli the Computer Guy 3,788,097 views 13 years ago 1 hour, 9 minutes
https://www.youtube.com/results?search_query=virtual+connection+tcpip	Introduction to TCP/IP and Sockets, part 1: Introducing the protocols and API by Rhymu's Videos 77,316 views 4 years ago 33 minutes
https://www.youtube.com/results?search_query=virtual+connection+tcpip	Dahua XVR TCP/IP Enable DHCP by Cris Dolosa 156,887 views 3 years ago 30 seconds
https://www.youtube.com/results?search_query=virtual+connection+tcpip	How TCP really works // Three-way handshake // TCP/IP Deep Dive by David Bombal 692,374 views 2 years ago 1 hour, 1 minute
https://www.youtube.com/results?search_query=virtual+connection+tcpip	Modbus TCP With Modbus Simulator by PHUK HOANG 44,071 views 4 years ago 3 minutes, 10 seconds
https://www.youtube.com/results?search_query=virtual+connection+tcpip	What is a TCP port and how is it used during connections? by internet-class 66,235 views 7 years ago 5 minutes, 54 seconds
https://www.youtube.com/results?search_query=virtual+connection+tcpip	Connect SoMove to Altivar Process Drive via Ethernet TCP/IP or Profinet | Schneider Electric Support by Schneider Electric 24,839 views 1 year ago 4 minutes, 46 seconds
https://www.youtube.com/results?search_query=virtual+connection+tcpip	What is TCP/IP? by Techquickie 1,560,885 views 8 years ago 6 minutes, 11 seconds
https://www.youtube.com/results?search_query=virtual+connection+tcpip	5.2 TCP Virtual Connections by OpenHPI Tutorials 40 views 5 years ago 10 minutes, 26 seconds
https://www.youtube.com/results?search_query=virtual+connection+tcpip	TIA V15.1 TCP/IP Communication with PLCSIM by Industrial Automation 31,582 views 4 years ago 5 minutes, 36 seconds
https://www.youtube.com/results?search_query=virtual+connection+tcpip	C# Tutorial - TCP/IP Client Server | FoxLearn by Fox Learn 396,710 views 7 years ago 10 minutes, 12 seconds
https://www.youtube.com/results?search_query=virtual+connection+tcpip	TCP/IP Protocol Explained | What Is TCP/IP Address? | TCP/IP Configuration Tutorial | Simplilearn by Simplilearn 116,869 views 2 years ago 8 minutes, 39 seconds
https://www.youtube.com/results?search_query=virtual+connection+tcpip	Sockets Tutorial with Python 3 part 1 - sending and receiving data by sentdex 811,388 views 5 years ago 14 minutes, 27 seconds
